{
	"customBack": true,
	"customPlayerStyle": ".player-table .name-wrapper",
	"playersBorder": [
		"#player-table-{{player_id}}"
	],
	"sideMenu": {
		"playerPanel": "player-table-{{player_id}}",
		"bottomPanel": "legend-table",
		"css": "#bga-jump-to_controls, .bga-jump-to_controls { display: none; } .desktop_version #game_play_area { padding-left: 50px; }"
	}
}
