{
	"overlay": true,
	"playersBorder": [
		"#playerboard_{{player_id}}"
	],
	"playersTextColor": [
		"#playerboard_{{player_id}}  .player_name"
	],
	"recommendedColor": {
		"hue": 0,
		"saturation": 20
	},
	"sideMenu": {
		"playerPanel": "playerboard_{{player_id}}",
		"iconBackgroundDark": "#8f663d"
	}
}
