{
	"customPanel": true,
	"playersBorder": [
		"#nameZone{{player_id}}"
	],
	"cssVars": {
		"--actionIcons": "img/LDD_Cards_Icons.png",
		"--playmat": "img/background.jpg"
	},
	"sideMenu": {
		"playerPanel": "nameCardCollection{{player_id}}",
		"css": ".goUp { display: none; } .desktop_version #game_play_area { padding-left: 50px; }",
		"boardPanel": "trashCollectionText",
		"boardPanelText": "#trashCollectionText",
		"bottomPanel": "cardListTitle"
	}
}
